{
  "from": "2017-04-06",
  "to": "2017-07-04",
  "incomes": {
    "rentIncome": {
      "amount": 100.25,
      "taxDeducted": 100.25
    },
    "premiumsOfLeaseGrant": { "amount": 100.25 },
    "reversePremiums": { "amount": 100.25 },
    "otherPropertyIncome": {"amount": 100.25},
    "rarRentReceived": {"amount": 100.25}
  },
  "expenses": {
    "premisesRunningCosts": { "amount": 100.25 },
    "repairsAndMaintenance": { "amount": 100.25 },
    "financialCosts": { "amount": 200.25 },
    "professionalFees": { "amount": 100.25 },
    "travelCosts": { "amount": 100.25 },
    "costOfServices": { "amount": 100.25 },
    "residentialFinancialCost": { "amount": 200.25 },
    "broughtFwdResidentialFinancialCost": { "amount": 100.25 },
    "other": { "amount": 100.25 },
    "rarReliefClaimed": { "amount": 100.25 }
  }
}
