{
  "from": "2018-04-06",
  "to": "2018-07-05",
  "incomes": {
    "rentIncome": {
      "amount": 100.25,
      "taxDeducted": 100.25
    },
    "premiumsOfLeaseGrant": { "amount": 100.25 },
    "reversePremiums": { "amount": 100.25 },
    "otherPropertyIncome": { "amount": 100.25 },
    "rarRentReceived": { "amount": 100.25 }
  },
  "expenses": {
    "consolidatedExpenses": { "amount": 100.25 },
    "residentialFinancialCost": { "amount": 100.25 },
    "broughtFwdResidentialFinancialCost": { "amount": 100.25 }
  }
}
